{
  "$schema": "http://json-schema.org/draft-04/schema#",
  "type": "object",
  "properties": {
    "accession": {
      "type": "string"
    },
    "current_accession": {
      "type": "string"
    },
    "paired_accession": {
      "type": "string"
    },
    "source_database": {
      "type": "string"
    },
    "organism": {
      "type": "object",
      "properties": {
        "tax_id": {
          "type": "integer"
        },
        "sci_name": {
          "type": "string"
        },
        "organism_name": {
          "type": "string"
        },
        "common_name": {
          "type": "string"
        },
        "lineage": {
          "type": "array",
          "items": {
            "type": "object",
            "properties": {
              "tax_id": {
                "type": "integer"
              },
              "name": {
                "type": "string"
              }
            }
          }
        },
        "strain": {
          "type": "string"
        },
        "pangolin_classification": {
          "type": "string"
        },
        "infraspecific_names": {
          "type": "object",
          "properties": {
            "breed": {
              "type": "string"
            },
            "cultivar": {
              "type": "string"
            },
            "ecotype": {
              "type": "string"
            },
            "isolate": {
              "type": "string"
            },
            "sex": {
              "type": "string"
            },
            "strain": {
              "type": "string"
            }
          }
        }
      }
    },
    "assembly_info": {
      "type": "object",
      "properties": {
        "assembly_level": {
          "type": "string"
        },
        "assembly_status": {
          "type": "string"
        },
        "paired_assembly": {
          "type": "object",
          "properties": {
            "accession": {
              "type": "string"
            },
            "status": {
              "type": "string"
            },
            "annotation_name": {
              "type": "string"
            },
            "only_genbank": {
              "type": "string"
            },
            "only_refseq": {
              "type": "string"
            },
            "changed": {
              "type": "string"
            },
            "manual_diff": {
              "type": "string"
            }
          }
        },
        "assembly_name": {
          "type": "string"
        },
        "assembly_type": {
          "type": "string"
        },
        "bioproject_lineage": {
          "type": "array",
          "items": {
            "type": "object",
            "properties": {
              "bioprojects": {
                "type": "array",
                "items": {
                  "type": "object",
                  "properties": {
                    "accession": {
                      "type": "string"
                    },
                    "title": {
                      "type": "string"
                    },
                    "parent_accession": {
                      "type": "string"
                    },
                    "parent_accessions": {
                      "type": "array",
                      "items": {
                        "type": "string"
                      }
                    }
                  }
                }
              }
            }
          }
        },
        "bioproject_accession": {
          "type": "string"
        },
        "submission_date": {
          "type": "string"
        },
        "release_date": {
          "type": "string"
        },
        "description": {
          "type": "string"
        },
        "submitter": {
          "type": "string"
        },
        "refseq_category": {
          "type": "string"
        },
        "synonym": {
          "type": "string"
        },
        "linked_assembly": {
          "type": "string"
        },
        "linked_assemblies": {
          "type": "array",
          "items": {
            "type": "object",
            "properties": {
              "linked_assembly": {
                "type": "string"
              },
              "assembly_type": {
                "type": "string"
              }
            }
          }
        },
        "atypical": {
          "type": "object",
          "properties": {
            "is_atypical": {
              "type": "boolean"
            },
            "warnings": {
              "type": "array",
              "items": {
                "type": "string"
              }
            }
          }
        },
        "genome_notes": {
          "type": "array",
          "items": {
            "type": "string"
          }
        },
        "sequencing_tech": {
          "type": "string"
        },
        "assembly_method": {
          "type": "string"
        },
        "biosample": {
          "type": "object",
          "properties": {
            "accession": {
              "type": "string"
            },
            "last_updated": {
              "type": "string"
            },
            "publication_date": {
              "type": "string"
            },
            "submission_date": {
              "type": "string"
            },
            "sample_ids": {
              "type": "array",
              "items": {
                "type": "object",
                "properties": {
                  "db": {
                    "type": "string"
                  },
                  "label": {
                    "type": "string"
                  },
                  "value": {
                    "type": "string"
                  }
                }
              }
            },
            "description": {
              "type": "object",
              "properties": {
                "title": {
                  "type": "string"
                },
                "organism": {
                  "type": "object",
                  "properties": {
                    "tax_id": {
                      "type": "integer"
                    },
                    "sci_name": {
                      "type": "string"
                    },
                    "organism_name": {
                      "type": "string"
                    },
                    "common_name": {
                      "type": "string"
                    },
                    "lineage": {
                      "type": "array",
                      "items": {
                        "type": "object",
                        "properties": {
                          "tax_id": {
                            "type": "integer"
                          },
                          "name": {
                            "type": "string"
                          }
                        }
                      }
                    },
                    "strain": {
                      "type": "string"
                    },
                    "pangolin_classification": {
                      "type": "string"
                    },
                    "infraspecific_names": {
                      "type": "object",
                      "properties": {
                        "breed": {
                          "type": "string"
                        },
                        "cultivar": {
                          "type": "string"
                        },
                        "ecotype": {
                          "type": "string"
                        },
                        "isolate": {
                          "type": "string"
                        },
                        "sex": {
                          "type": "string"
                        },
                        "strain": {
                          "type": "string"
                        }
                      }
                    }
                  }
                },
                "comment": {
                  "type": "string"
                }
              }
            },
            "owner": {
              "type": "object",
              "properties": {
                "name": {
                  "type": "string"
                },
                "contacts": {
                  "type": "array",
                  "items": {
                    "type": "object",
                    "properties": {
                      "lab": {
                        "type": "string"
                      }
                    }
                  }
                }
              }
            },
            "models": {
              "type": "array",
              "items": {
                "type": "string"
              }
            },
            "bioprojects": {
              "type": "array",
              "items": {
                "type": "object",
                "properties": {
                  "accession": {
                    "type": "string"
                  },
                  "title": {
                    "type": "string"
                  },
                  "parent_accession": {
                    "type": "string"
                  },
                  "parent_accessions": {
                    "type": "array",
                    "items": {
                      "type": "string"
                    }
                  }
                }
              }
            },
            "package": {
              "type": "string"
            },
            "attributes": {
              "type": "array",
              "items": {
                "type": "object",
                "properties": {
                  "name": {
                    "type": "string"
                  },
                  "value": {
                    "type": "string"
                  }
                }
              }
            },
            "status": {
              "type": "object",
              "properties": {
                "status": {
                  "type": "string"
                },
                "when": {
                  "type": "string"
                }
              }
            }
          }
        },
        "blast_url": {
          "type": "string"
        },
        "comments": {
          "type": "string"
        },
        "suppression_reason": {
          "type": "string"
        },
        "diploid_role": {
          "type": "string"
        }
      }
    },
    "assembly_stats": {
      "type": "object",
      "properties": {
        "total_number_of_chromosomes": {
          "type": "integer"
        },
        "total_sequence_length": {
          "type": "string"
        },
        "total_ungapped_length": {
          "type": "string"
        },
        "number_of_contigs": {
          "type": "integer"
        },
        "contig_n50": {
          "type": "integer"
        },
        "contig_l50": {
          "type": "integer"
        },
        "number_of_scaffolds": {
          "type": "integer"
        },
        "scaffold_n50": {
          "type": "integer"
        },
        "scaffold_l50": {
          "type": "integer"
        },
        "gaps_between_scaffolds_count": {
          "type": "integer"
        },
        "number_of_component_sequences": {
          "type": "integer"
        },
        "gc_count": {
          "type": "string"
        },
        "gc_percent": {
          "type": "integer"
        },
        "genome_coverage": {
          "type": "string"
        },
        "number_of_organelles": {
          "type": "integer"
        }
      }
    },
    "organelle_info": {
      "type": "array",
      "items": {
        "type": "object",
        "properties": {
          "assembly_name": {
            "type": "string"
          },
          "infraspecific_name": {
            "type": "string"
          },
          "bioproject": {
            "type": "array",
            "items": {
              "type": "string"
            }
          },
          "description": {
            "type": "string"
          },
          "total_seq_length": {
            "type": "string"
          },
          "submitter": {
            "type": "string"
          }
        }
      }
    },
    "annotation_info": {
      "type": "object",
      "properties": {
        "name": {
          "type": "string"
        },
        "provider": {
          "type": "string"
        },
        "release_date": {
          "type": "string"
        },
        "report_url": {
          "type": "string"
        },
        "stats": {
          "type": "object",
          "properties": {
            "gene_counts": {
              "type": "object",
              "properties": {
                "total": {
                  "type": "integer"
                },
                "protein_coding": {
                  "type": "integer"
                },
                "non_coding": {
                  "type": "integer"
                },
                "pseudogene": {
                  "type": "integer"
                },
                "other": {
                  "type": "integer"
                }
              }
            }
          }
        },
        "busco": {
          "type": "object",
          "properties": {
            "busco_lineage": {
              "type": "string"
            },
            "busco_ver": {
              "type": "string"
            },
            "complete": {
              "type": "integer"
            },
            "single_copy": {
              "type": "integer"
            },
            "duplicated": {
              "type": "integer"
            },
            "fragmented": {
              "type": "integer"
            },
            "missing": {
              "type": "integer"
            },
            "total_count": {
              "type": "string"
            }
          }
        },
        "method": {
          "type": "string"
        },
        "pipeline": {
          "type": "string"
        },
        "software_version": {
          "type": "string"
        },
        "status": {
          "type": "string"
        },
        "release_version": {
          "type": "string"
        }
      }
    },
    "wgs_info": {
      "type": "object",
      "properties": {
        "wgs_project_accession": {
          "type": "string"
        },
        "master_wgs_url": {
          "type": "string"
        },
        "wgs_contigs_url": {
          "type": "string"
        }
      }
    },
    "type_material": {
      "type": "object",
      "properties": {
        "type_label": {
          "type": "string"
        },
        "type_display_text": {
          "type": "string"
        }
      }
    },
    "checkm_info": {
      "type": "object",
      "properties": {
        "checkm_marker_set": {
          "type": "string"
        },
        "checkm_species_tax_id": {
          "type": "integer"
        },
        "checkm_marker_set_rank": {
          "type": "string"
        },
        "checkm_version": {
          "type": "string"
        },
        "completeness": {
          "type": "integer"
        },
        "contamination": {
          "type": "integer"
        },
        "completeness_percentile": {
          "type": "integer"
        }
      }
    },
    "average_nucleotide_identity": {
      "type": "object",
      "properties": {
        "taxonomy_check_status": {
          "type": "string"
        },
        "match_status": {
          "type": "string"
        },
        "submitted_organism": {
          "type": "string"
        },
        "submitted_species": {
          "type": "string"
        },
        "category": {
          "type": "string"
        },
        "submitted_ani_match": {
          "type": "object",
          "properties": {
            "assembly": {
              "type": "string"
            },
            "organism_name": {
              "type": "string"
            },
            "category": {
              "type": "string"
            },
            "ani": {
              "type": "integer"
            },
            "assembly_coverage": {
              "type": "integer"
            },
            "type_assembly_coverage": {
              "type": "integer"
            }
          }
        },
        "best_ani_match": {
          "type": "object",
          "properties": {
            "assembly": {
              "type": "string"
            },
            "organism_name": {
              "type": "string"
            },
            "category": {
              "type": "string"
            },
            "ani": {
              "type": "integer"
            },
            "assembly_coverage": {
              "type": "integer"
            },
            "type_assembly_coverage": {
              "type": "integer"
            }
          }
        },
        "comment": {
          "type": "string"
        }
      }
    }
  }
}